{
  "id":"freyna-forbidden-sanctuary","descendant":"Ultimate Freyna","title":"Ultimate Freyna — Forbidden Sanctuary","patch":"S3E4","updatedAt":"2026-06-20","source":{"author":"Alcast","url":"https://tfd.gameslantern.com/builds/019afe35-d7ed-7189-a737-603804bd6de9/freyna-forbidden-sanctuary-venom-injection-build","type":"article"},
  "sections":[{"type":"trigger","label":"Trigger Module","items":[{"id":"trigger-infected-weapon","name":"Infected Weapon","priority":"P0","note":"Trigger recomendado.","quantity":1}]},{"type":"descendantModules","label":"Módulos do Descendant","items":[{"id":"mod-venom-injection","name":"Venom Injection","priority":"P0","note":"Fonte principal do dano contra o chefe.","quantity":1},{"id":"mod-power-increase","name":"Power Increase","priority":"P1","note":"Skill Power.","quantity":1},{"id":"mod-focus-on-tech","name":"Focus on Tech","priority":"P1","note":"Tech Skill Power.","quantity":1},{"id":"mod-skill-expansion","name":"Skill Expansion","priority":"P1","note":"Área.","quantity":1},{"id":"mod-nimble-fingers","name":"Nimble Fingers","priority":"P1","note":"Cooldown.","quantity":1},{"id":"mod-mp-conversion","name":"MP Conversion","priority":"P1","note":"Sustain.","quantity":1},{"id":"mod-mid-air-maneuvering","name":"Mid-Air Maneuvering","priority":"P2","note":"Mobilidade.","quantity":1},{"id":"mod-toxic-amplification","name":"Toxic Amplification","priority":"P1","note":"Dano Toxic.","quantity":1},{"id":"mod-decimator","name":"Decimator","priority":"P1","note":"Escala o dano.","quantity":1},{"id":"mod-tech-amplification","name":"Tech Amplification","priority":"P1","note":"Dano Tech.","quantity":1},{"id":"mod-overwhelming-shield","name":"Overwhelming Shield","priority":"P1","note":"Defesa da configuração.","quantity":1}]},{"type":"weapon","label":"Arma principal","items":[{"id":"weapon-fallen-hope","name":"Fallen Hope","priority":"P0","note":"Amplifica Toxic Skill Power.","quantity":1}]},{"type":"reactor","label":"Reator","items":[{"id":"reactor-toxic-mechanics","name":"Toxic Mechanics Reactor","priority":"P0","note":"Toxic + Tech.","quantity":1},{"id":"roll-skill-cooldown","name":"Skill Cooldown","priority":"P1","note":"Buscar 80–90% no conjunto.","quantity":1}]}]
}
