{
  "id": "kyle-wall-crasher-nuke",
  "descendant": "Kyle",
  "title": "Kyle — Wall Crasher Group Nuke",
  "patch": "S3E4",
  "updatedAt": "2026-02-20",
  "source": {
    "author": "Alcast",
    "url": "https://tfd.gameslantern.com/builds/019a542e-5c7c-73d8-90f0-af7d95e422c5/kyle-wall-crasher-group-nuke-build-with-luna",
    "type": "article"
  },
  "sections": [
    {
      "type": "descendantModules",
      "label": "Módulos do Descendant",
      "items": [
        {
          "id": "mod-superconductive-bombing-mark-2",
          "name": "Superconductive Bombing MARK 2",
          "priority": "P0",
          "note": "Transcendent para o nuke.",
          "quantity": 1
        },
        {
          "id": "mod-skill-concentration",
          "name": "Skill Concentration",
          "priority": "P1",
          "note": "Dano crítico.",
          "quantity": 1
        },
        {
          "id": "mod-maximize-duration",
          "name": "Maximize Duration",
          "priority": "P1",
          "note": "Duração.",
          "quantity": 1
        },
        {
          "id": "mod-skill-extension",
          "name": "Skill Extension",
          "priority": "P1",
          "note": "Duração.",
          "quantity": 1
        },
        {
          "id": "mod-maximize-skill",
          "name": "Maximize Skill",
          "priority": "P1",
          "note": "Skill Power.",
          "quantity": 1
        },
        {
          "id": "mod-increased-shield",
          "name": "Increased Shield",
          "priority": "P1",
          "note": "Recurso e defesa do Kyle.",
          "quantity": 1
        },
        {
          "id": "mod-mid-air-maneuvering",
          "name": "Mid-Air Maneuvering",
          "priority": "P2",
          "note": "Mobilidade.",
          "quantity": 1
        },
        {
          "id": "mod-hyperfocus",
          "name": "Hyperfocus",
          "priority": "P0",
          "note": "Ativar com um tiro crítico antes da skill.",
          "quantity": 1
        }
      ]
    },
    {
      "type": "weapon",
      "label": "Arma de ativação",
      "items": [
        {
          "id": "weapon-secret-garden",
          "name": "Secret Garden",
          "priority": "P0",
          "note": "Usada para ativar Hyperfocus antes do nuke.",
          "quantity": 1
        }
      ]
    },
    {
      "type": "reactor",
      "label": "Reator",
      "items": [
        {
          "id": "reactor-materialized-mixture",
          "name": "Materialized Mixture Reactor",
          "priority": "P0",
          "note": "Reator principal da fonte.",
          "quantity": 1
        },
        {
          "id": "roll-additional-skill-atk-vs-colossus",
          "name": "Additional Skill ATK (vs. Colossus)",
          "priority": "P1",
          "note": "Roll de bossing.",
          "quantity": 1
        }
      ]
    },
    {
      "type": "weaponModules",
      "label": "Módulos da arma",
      "sourceStatus": "confirmed",
      "sourceNote": "Configuração publicada pela fonte da build.",
      "items": [
        {
          "id": "mod-better-insight",
          "name": "Better Insight",
          "priority": "P1",
          "note": "Nível 8 na fonte.",
          "quantity": 1,
          "targetLevel": 8
        },
        {
          "id": "mod-insight-focus",
          "name": "Insight Focus",
          "priority": "P1",
          "note": "Nível 6 na fonte.",
          "quantity": 1,
          "targetLevel": 6
        },
        {
          "id": "mod-brisk-walk",
          "name": "Brisk Walk",
          "priority": "P1",
          "note": "Nível 8 na fonte.",
          "quantity": 1,
          "targetLevel": 8
        },
        {
          "id": "mod-chill-enhancement",
          "name": "Chill Enhancement",
          "priority": "P1",
          "note": "Nível 8 na fonte.",
          "quantity": 1,
          "targetLevel": 8
        },
        {
          "id": "mod-fire-rate-up",
          "name": "Fire Rate UP",
          "priority": "P1",
          "note": "Nível 6 na fonte.",
          "quantity": 1,
          "targetLevel": 6
        }
      ]
    },
    {
      "type": "weaponTargetRolls",
      "label": "Rolls-alvo da arma",
      "sourceStatus": "confirmed",
      "sourceNote": "Atributos publicados pela fonte, na ordem exibida.",
      "items": [
        {
          "id": "roll-rounds-per-magazine",
          "name": "Rounds per Magazine",
          "priority": null,
          "note": "Roll confirmado na fonte.",
          "quantity": 1
        },
        {
          "id": "roll-firearm-critical-hit-damage",
          "name": "Firearm Critical Hit Damage",
          "priority": null,
          "note": "Roll confirmado na fonte.",
          "quantity": 1
        },
        {
          "id": "roll-firearm-critical-hit-rate",
          "name": "Firearm Critical Hit Rate",
          "priority": null,
          "note": "Roll confirmado na fonte.",
          "quantity": 1
        },
        {
          "id": "roll-weapon-change-speed",
          "name": "Weapon Change Speed",
          "priority": null,
          "note": "Roll confirmado na fonte.",
          "quantity": 1
        }
      ]
    },
    {
      "type": "weaponCores",
      "label": "Configuração de cores da arma",
      "sourceStatus": "confirmed",
      "sourceNote": "Augmentations publicadas pela fonte, na ordem exibida.",
      "items": [
        {
          "id": "core-fire-rate",
          "name": "Fire Rate",
          "priority": null,
          "note": "Augmentation confirmada na fonte.",
          "quantity": 1
        },
        {
          "id": "core-firearm-critical-hit-damage",
          "name": "Firearm Critical Hit Damage",
          "priority": null,
          "note": "Augmentation confirmada na fonte.",
          "quantity": 1
        },
        {
          "id": "core-sprint-speed",
          "name": "Sprint Speed",
          "priority": null,
          "note": "Augmentation confirmada na fonte.",
          "quantity": 1
        },
        {
          "id": "core-grappling-hook-charge-time-increase-ratio",
          "name": "Grappling Hook Charge Time Increase Ratio",
          "priority": null,
          "note": "Augmentation confirmada na fonte.",
          "quantity": 1
        },
        {
          "id": "core-additional-weapon-atk-vs-legion-of-breach",
          "name": "Additional Weapon ATK (vs. Legion of Breach)",
          "priority": null,
          "note": "Augmentation confirmada na fonte.",
          "quantity": 1
        }
      ]
    }
  ]
}
