{
  "id": "valby-hydro-pressure-bomb",
  "descendant": "Ultimate Valby",
  "title": "Ultimate Valby — Hydro Pressure Bomb",
  "patch": "S3E4",
  "updatedAt": "2026-05-20",
  "source": {
    "author": "MagicAttacks",
    "url": "https://tfd.gameslantern.com/builds/019d8cc3-6b3e-7180-9909-809f0a0ba6ab/valby-hydro-pressure-bomb-build",
    "type": "article"
  },
  "sections": [
    {
      "type": "descendantModules",
      "label": "Módulos do Descendant",
      "items": [
        {
          "id": "mod-hydro-pressure-bomb",
          "name": "Hydro Pressure Bomb",
          "priority": "P0",
          "note": "Transcendent central da build.",
          "quantity": 1
        },
        {
          "id": "mod-mp-conversion",
          "name": "MP Conversion",
          "priority": "P1",
          "note": "Sustain.",
          "quantity": 1
        },
        {
          "id": "mod-focus-on-non-attribute",
          "name": "Focus on Non-Attribute",
          "priority": "P1",
          "note": "Dano Non-Attribute.",
          "quantity": 1
        },
        {
          "id": "mod-skill-expansion",
          "name": "Skill Expansion",
          "priority": "P1",
          "note": "Área.",
          "quantity": 1
        },
        {
          "id": "mod-increased-hp",
          "name": "Increased HP",
          "priority": "P1",
          "note": "Sobrevivência.",
          "quantity": 1
        },
        {
          "id": "mod-mid-air-maneuvering",
          "name": "Mid-Air Maneuvering",
          "priority": "P2",
          "note": "Mobilidade.",
          "quantity": 1
        },
        {
          "id": "mod-nimble-fingers",
          "name": "Nimble Fingers",
          "priority": "P1",
          "note": "Cooldown.",
          "quantity": 1
        },
        {
          "id": "mod-focus-on-fusion",
          "name": "Focus on Fusion",
          "priority": "P1",
          "note": "Fusion Skill Power.",
          "quantity": 1
        },
        {
          "id": "mod-skill-extension",
          "name": "Skill Extension",
          "priority": "P1",
          "note": "Duração.",
          "quantity": 1
        }
      ]
    },
    {
      "type": "weapon",
      "label": "Arma principal",
      "items": [
        {
          "id": "weapon-peace-maker",
          "name": "Peace Maker",
          "priority": "P0",
          "note": "Stat stick da configuração.",
          "quantity": 1
        }
      ]
    },
    {
      "type": "reactor",
      "label": "Reator",
      "items": [
        {
          "id": "reactor-materialized-mixture",
          "name": "Materialized Mixture Reactor",
          "priority": "P0",
          "note": "Non-Attribute + Fusion.",
          "quantity": 1
        },
        {
          "id": "roll-skill-cooldown",
          "name": "Skill Cooldown",
          "priority": "P1",
          "note": "Roll alvo.",
          "quantity": 1
        },
        {
          "id": "roll-fusion-skill-power-boost-ratio",
          "name": "Fusion Skill Power Boost Ratio",
          "priority": "P1",
          "note": "Roll alvo.",
          "quantity": 1
        }
      ]
    },
    {
      "type": "weaponModules",
      "label": "Módulos da arma",
      "sourceStatus": "notProvided",
      "sourceNote": "A fonte não publicou módulos para esta arma.",
      "items": []
    },
    {
      "type": "weaponTargetRolls",
      "label": "Rolls-alvo da arma",
      "sourceStatus": "notProvided",
      "sourceNote": "A fonte não publicou rolls para esta arma.",
      "items": []
    },
    {
      "type": "weaponCores",
      "label": "Configuração de cores da arma",
      "sourceStatus": "confirmed",
      "sourceNote": "Augmentations publicadas pela fonte, na ordem exibida.",
      "items": [
        {
          "id": "core-sprint-speed",
          "name": "Sprint Speed",
          "priority": null,
          "note": "Augmentation confirmada na fonte.",
          "quantity": 1
        },
        {
          "id": "core-sprint-speed",
          "name": "Sprint Speed",
          "priority": null,
          "note": "Augmentation confirmada na fonte.",
          "quantity": 1
        },
        {
          "id": "core-grappling-hook-charge-time-increase-ratio",
          "name": "Grappling Hook Charge Time Increase Ratio",
          "priority": null,
          "note": "Augmentation confirmada na fonte.",
          "quantity": 1
        }
      ]
    }
  ]
}
