{
  "id":"sharen-ultimate-ambush","descendant":"Ultimate Sharen","title":"Ultimate Sharen — Ambush Endgame","patch":"S3E4","updatedAt":"2026-04-20","source":{"author":"goddragonaos","url":"https://tfd.gameslantern.com/builds/019d3ed9-4afb-71d4-9a34-b636c0802406/ultimate-ambush-sharen","type":"article"},
  "sections":[{"type":"descendantModules","label":"Módulos do Descendant","items":[{"id":"mod-ambushed","name":"Ambushed","priority":"P0","note":"Transcendent central da configuração.","quantity":1},{"id":"mod-emergency-measures","name":"Emergency Measures","priority":"P1","note":"Crítico.","quantity":1},{"id":"mod-nimble-fingers","name":"Nimble Fingers","priority":"P1","note":"Cooldown.","quantity":1},{"id":"mod-focus-on-electric","name":"Focus on Electric","priority":"P1","note":"Electric Skill Power.","quantity":1},{"id":"mod-skill-expansion","name":"Skill Expansion","priority":"P1","note":"Área.","quantity":1},{"id":"mod-front-lines","name":"Front Lines","priority":"P1","note":"Dano crítico.","quantity":1},{"id":"mod-mid-air-maneuvering","name":"Mid-Air Maneuvering","priority":"P2","note":"Mobilidade.","quantity":1},{"id":"mod-mp-conversion","name":"MP Conversion","priority":"P1","note":"Sustain.","quantity":1},{"id":"mod-skill-concentration","name":"Skill Concentration","priority":"P1","note":"Dano crítico.","quantity":1},{"id":"mod-skill-extension","name":"Skill Extension","priority":"P1","note":"Duração.","quantity":1}]},{"type":"weapon","label":"Arma principal","items":[{"id":"weapon-blue-beetle","name":"Blue Beetle","priority":"P0","note":"Arma principal da fonte.","quantity":1}]},{"type":"reactor","label":"Reator","items":[{"id":"reactor-tingling-mixture","name":"Tingling Mixture Reactor","priority":"P0","note":"Electric + Fusion.","quantity":1},{"id":"roll-skill-cooldown","name":"Skill Cooldown","priority":"P1","note":"Roll alvo.","quantity":1},{"id":"roll-skill-critical-hit-damage","name":"Skill Critical Hit Damage","priority":"P1","note":"Roll alvo.","quantity":1}]}]
}
