{
  "id":"bunny-400-infinite-sustain","descendant":"Ultimate Bunny","title":"Ultimate Bunny — 400% Infinite Sustain","patch":"S3E4","updatedAt":"2026-08-14","source":{"author":"Alcast","url":"https://tfd.gameslantern.com/builds/019ac598-bf4c-717d-a727-51fa7a2cb7c4/fastest-bunny-build-for-400-dungeon-farming-infinite-sustain","type":"article"},
  "sections":[{"type":"trigger","label":"Trigger Module","items":[{"id":"trigger-golden-ensemble","name":"Golden Ensemble","priority":"P0","note":"Trigger da configuração.","quantity":1}]},{"type":"descendantModules","label":"Módulos do Descendant","items":[{"id":"mod-electric-condense","name":"Electric Condense","priority":"P0","note":"Transcendent para explosão e limpeza.","quantity":1},{"id":"mod-skill-expansion","name":"Skill Expansion","priority":"P1","note":"Área.","quantity":1},{"id":"mod-focus-on-electric","name":"Focus on Electric","priority":"P1","note":"Electric Skill Power.","quantity":1},{"id":"mod-amplification-control","name":"Amplification Control","priority":"P1","note":"Alcance.","quantity":1},{"id":"mod-electric-amplification","name":"Electric Amplification","priority":"P1","note":"Dano não crítico.","quantity":1},{"id":"mod-mid-air-maneuvering","name":"Mid-Air Maneuvering","priority":"P2","note":"Mobilidade.","quantity":1},{"id":"mod-nimble-fingers","name":"Nimble Fingers","priority":"P1","note":"Cooldown.","quantity":1},{"id":"mod-mp-conversion","name":"MP Conversion","priority":"P1","note":"Sustain.","quantity":1},{"id":"mod-decimator","name":"Decimator","priority":"P1","note":"Escala dano durante o farm.","quantity":1},{"id":"mod-maximize-conservation","name":"Maximize Conservation","priority":"P1","note":"Sustain de MP.","quantity":1}]},{"type":"weapon","label":"Arma principal","items":[{"id":"weapon-peace-maker","name":"Peace Maker","priority":"P2","note":"Stat stick para velocidade e grapple.","quantity":1}]},{"type":"reactor","label":"Reator","items":[{"id":"reactor-tingling-mixture","name":"Tingling Mixture Reactor","priority":"P0","note":"Electric + Fusion.","quantity":1},{"id":"roll-skill-cooldown","name":"Skill Cooldown","priority":"P1","note":"Roll recomendado.","quantity":1}]}]
}
