{
  "id": "valby-void-erosion-purge",
  "descendant": "Ultimate Valby",
  "title": "Ultimate Valby — Void Erosion Purge",
  "patch": "S3E4",
  "updatedAt": "2025-12-20",
  "source": {
    "author": "Xeloki",
    "url": "https://tfd.gameslantern.com/builds/019abab3-4f2b-734e-893f-aef7df7e4878/valby-build-for-void-erosion-purge",
    "type": "article"
  },
  "sections": [
    {
      "type": "descendantModules",
      "label": "Módulos do Descendant",
      "items": [
        {
          "id": "mod-supply-moisture",
          "name": "Supply Moisture",
          "priority": "P0",
          "note": "Mantenha-se na água para receber os bônus.",
          "quantity": 1
        },
        {
          "id": "mod-skill-expansion",
          "name": "Skill Expansion",
          "priority": "P1",
          "note": "Área.",
          "quantity": 1
        },
        {
          "id": "mod-decimator",
          "name": "Decimator",
          "priority": "P1",
          "note": "Escala dano.",
          "quantity": 1
        },
        {
          "id": "mod-nimble-fingers",
          "name": "Nimble Fingers",
          "priority": "P1",
          "note": "Cooldown.",
          "quantity": 1
        },
        {
          "id": "mod-mp-conversion",
          "name": "MP Conversion",
          "priority": "P1",
          "note": "Sustain.",
          "quantity": 1
        },
        {
          "id": "mod-focus-on-non-attribute",
          "name": "Focus on Non-Attribute",
          "priority": "P1",
          "note": "Non-Attribute Skill Power.",
          "quantity": 1
        },
        {
          "id": "mod-mid-air-maneuvering",
          "name": "Mid-Air Maneuvering",
          "priority": "P2",
          "note": "Mobilidade.",
          "quantity": 1
        },
        {
          "id": "mod-focus-on-fusion",
          "name": "Focus on Fusion",
          "priority": "P1",
          "note": "Fusion Skill Power.",
          "quantity": 1
        },
        {
          "id": "mod-skill-concentration",
          "name": "Skill Concentration",
          "priority": "P1",
          "note": "Dano crítico.",
          "quantity": 1
        },
        {
          "id": "mod-front-lines",
          "name": "Front Lines",
          "priority": "P1",
          "note": "Dano crítico.",
          "quantity": 1
        }
      ]
    },
    {
      "type": "weapon",
      "label": "Arma principal",
      "items": [
        {
          "id": "weapon-peace-maker",
          "name": "Peace Maker",
          "priority": "P0",
          "note": "Arma indicada pela fonte.",
          "quantity": 1
        }
      ]
    },
    {
      "type": "reactor",
      "label": "Reator",
      "items": [
        {
          "id": "reactor-materialized-mixture",
          "name": "Materialized Mixture Reactor",
          "priority": "P0",
          "note": "Buscar dano adicional contra Legion of Darkness.",
          "quantity": 1
        },
        {
          "id": "roll-fusion-skill-power-boost-ratio",
          "name": "Fusion Skill Power Boost Ratio",
          "priority": "P1",
          "note": "Roll alvo.",
          "quantity": 1
        }
      ]
    },
    {
      "type": "weaponModules",
      "label": "Módulos da arma",
      "sourceStatus": "confirmed",
      "sourceNote": "Configuração publicada pela fonte da build.",
      "items": [
        {
          "id": "mod-fire-rate-up",
          "name": "Fire Rate UP",
          "priority": "P1",
          "note": "Nível 6 na fonte.",
          "quantity": 1,
          "targetLevel": 6
        },
        {
          "id": "mod-payout",
          "name": "Payout",
          "priority": "P1",
          "note": "Nível 8 na fonte.",
          "quantity": 1,
          "targetLevel": 8
        },
        {
          "id": "mod-expand-weapon-charge",
          "name": "Expand Weapon Charge",
          "priority": "P1",
          "note": "Nível 8 na fonte.",
          "quantity": 1,
          "targetLevel": 8
        },
        {
          "id": "mod-compulsive-magazine",
          "name": "Compulsive Magazine",
          "priority": "P1",
          "note": "Nível 8 na fonte.",
          "quantity": 1,
          "targetLevel": 8
        },
        {
          "id": "mod-hawk-eye",
          "name": "Hawk-Eye",
          "priority": "P1",
          "note": "Nível 7 na fonte.",
          "quantity": 1,
          "targetLevel": 7
        },
        {
          "id": "mod-recycling-genius",
          "name": "Recycling Genius",
          "priority": "P1",
          "note": "Nível 7 na fonte.",
          "quantity": 1,
          "targetLevel": 7
        },
        {
          "id": "mod-reload-insight",
          "name": "Reload Insight",
          "priority": "P1",
          "note": "Nível 6 na fonte.",
          "quantity": 1,
          "targetLevel": 6
        },
        {
          "id": "mod-tactical-change",
          "name": "Tactical Change",
          "priority": "P1",
          "note": "Nível 8 na fonte.",
          "quantity": 1,
          "targetLevel": 8
        },
        {
          "id": "mod-better-weapon-weight",
          "name": "Better Weapon Weight",
          "priority": "P1",
          "note": "Nível 6 na fonte.",
          "quantity": 1,
          "targetLevel": 6
        },
        {
          "id": "mod-weak-point-aiming",
          "name": "Weak Point Aiming",
          "priority": "P1",
          "note": "Nível 5 na fonte.",
          "quantity": 1,
          "targetLevel": 5
        }
      ]
    },
    {
      "type": "weaponTargetRolls",
      "label": "Rolls-alvo da arma",
      "sourceStatus": "confirmed",
      "sourceNote": "Atributos publicados pela fonte, na ordem exibida.",
      "items": [
        {
          "id": "roll-rounds-per-magazine",
          "name": "Rounds per Magazine",
          "priority": null,
          "note": "Roll confirmado na fonte.",
          "quantity": 1
        },
        {
          "id": "roll-firearm-atk",
          "name": "Firearm ATK",
          "priority": null,
          "note": "Roll confirmado na fonte.",
          "quantity": 1
        },
        {
          "id": "roll-firearm-critical-hit-damage",
          "name": "Firearm Critical Hit Damage",
          "priority": null,
          "note": "Roll confirmado na fonte.",
          "quantity": 1
        },
        {
          "id": "roll-fire-atk",
          "name": "Fire ATK",
          "priority": null,
          "note": "Roll confirmado na fonte.",
          "quantity": 1
        }
      ]
    },
    {
      "type": "weaponCores",
      "label": "Configuração de cores da arma",
      "sourceStatus": "confirmed",
      "sourceNote": "Augmentations publicadas pela fonte, na ordem exibida.",
      "items": [
        {
          "id": "core-sprint-speed",
          "name": "Sprint Speed",
          "priority": null,
          "note": "Augmentation confirmada na fonte.",
          "quantity": 1
        },
        {
          "id": "core-firearm-critical-hit-damage",
          "name": "Firearm Critical Hit Damage",
          "priority": null,
          "note": "Augmentation confirmada na fonte.",
          "quantity": 1
        },
        {
          "id": "core-fire-rate",
          "name": "Fire Rate",
          "priority": null,
          "note": "Augmentation confirmada na fonte.",
          "quantity": 1
        },
        {
          "id": "core-sprint-speed",
          "name": "Sprint Speed",
          "priority": null,
          "note": "Augmentation confirmada na fonte.",
          "quantity": 1
        },
        {
          "id": "core-grappling-hook-charge-time-increase-ratio",
          "name": "Grappling Hook Charge Time Increase Ratio",
          "priority": null,
          "note": "Augmentation confirmada na fonte.",
          "quantity": 1
        }
      ]
    }
  ]
}
