{
  "id": "yujin-allergic",
  "descendant": "Ultimate Yujin",
  "title": "Ultimate Yujin — Proliferating Allergy",
  "patch": "S3E4",
  "updatedAt": "2026-03-20",
  "source": {
    "author": "Halftyrk",
    "url": "https://tfd.gameslantern.com/builds/019c5609-cb42-708e-a0f5-03cd06514986/yujin-allergic-build",
    "type": "article"
  },
  "sections": [
    {
      "type": "descendantModules",
      "label": "Módulos do Descendant",
      "items": [
        {
          "id": "mod-proliferating-allergy",
          "name": "Proliferating Allergy",
          "priority": "P0",
          "note": "Base do dano contagioso.",
          "quantity": 1
        },
        {
          "id": "mod-emergency-measures",
          "name": "Emergency Measures",
          "priority": "P1",
          "note": "Crítico.",
          "quantity": 1
        },
        {
          "id": "mod-front-lines",
          "name": "Front Lines",
          "priority": "P1",
          "note": "Dano crítico.",
          "quantity": 1
        },
        {
          "id": "mod-focus-on-singular",
          "name": "Focus on Singular",
          "priority": "P1",
          "note": "Singular Skill Power.",
          "quantity": 1
        },
        {
          "id": "mod-focus-on-non-attribute",
          "name": "Focus on Non-Attribute",
          "priority": "P1",
          "note": "Non-Attribute Skill Power.",
          "quantity": 1
        },
        {
          "id": "mod-mp-conversion",
          "name": "MP Conversion",
          "priority": "P1",
          "note": "Sustain.",
          "quantity": 1
        },
        {
          "id": "mod-mid-air-maneuvering",
          "name": "Mid-Air Maneuvering",
          "priority": "P2",
          "note": "Mobilidade.",
          "quantity": 1
        },
        {
          "id": "mod-amplification-control",
          "name": "Amplification Control",
          "priority": "P1",
          "note": "Área.",
          "quantity": 1
        },
        {
          "id": "mod-nimble-fingers",
          "name": "Nimble Fingers",
          "priority": "P1",
          "note": "Cooldown.",
          "quantity": 1
        },
        {
          "id": "mod-skill-expansion",
          "name": "Skill Expansion",
          "priority": "P1",
          "note": "Área.",
          "quantity": 1
        },
        {
          "id": "mod-skill-concentration",
          "name": "Skill Concentration",
          "priority": "P1",
          "note": "Dano crítico.",
          "quantity": 1
        }
      ]
    },
    {
      "type": "reactor",
      "label": "Reator",
      "items": [
        {
          "id": "reactor-materialized-singularity",
          "name": "Materialized Singularity Reactor",
          "priority": "P0",
          "note": "Non-Attribute + Singular.",
          "quantity": 1
        },
        {
          "id": "roll-skill-cooldown",
          "name": "Skill Cooldown",
          "priority": "P1",
          "note": "Roll alvo.",
          "quantity": 1
        }
      ]
    },
    {
      "type": "weapon",
      "label": "Arma principal",
      "items": [
        {
          "id": "weapon-shadow",
          "name": "Shadow",
          "priority": "P0",
          "note": "Arma principal confirmada na fonte.",
          "quantity": 1
        }
      ]
    },
    {
      "type": "weaponModules",
      "label": "Módulos da arma",
      "sourceStatus": "confirmed",
      "sourceNote": "Configuração publicada pela fonte da build.",
      "items": [
        {
          "id": "mod-toxic-conductor",
          "name": "Toxic Conductor",
          "priority": "P1",
          "note": "Nível 8 na fonte.",
          "quantity": 1,
          "targetLevel": 8
        },
        {
          "id": "mod-toxic-edge",
          "name": "Toxic Edge",
          "priority": "P1",
          "note": "Nível 8 na fonte.",
          "quantity": 1,
          "targetLevel": 8
        },
        {
          "id": "mod-toxic-enhancement",
          "name": "Toxic Enhancement",
          "priority": "P1",
          "note": "Nível 7 na fonte.",
          "quantity": 1,
          "targetLevel": 7
        },
        {
          "id": "mod-faster-attack-speed",
          "name": "Faster Attack Speed",
          "priority": "P1",
          "note": "Nível 8 na fonte.",
          "quantity": 1,
          "targetLevel": 8
        },
        {
          "id": "mod-one-point-breakthrough",
          "name": "One-Point Breakthrough",
          "priority": "P1",
          "note": "Nível 8 na fonte.",
          "quantity": 1,
          "targetLevel": 8
        },
        {
          "id": "mod-double-edge-extension",
          "name": "Double Edge Extension",
          "priority": "P1",
          "note": "Nível 8 na fonte.",
          "quantity": 1,
          "targetLevel": 8
        },
        {
          "id": "mod-veil-analyzer",
          "name": "Veil Analyzer",
          "priority": "P1",
          "note": "Nível 8 na fonte.",
          "quantity": 1,
          "targetLevel": 8
        },
        {
          "id": "mod-increased-range",
          "name": "Increased Range",
          "priority": "P1",
          "note": "Nível 8 na fonte.",
          "quantity": 1,
          "targetLevel": 8
        },
        {
          "id": "mod-hardened-reinforcement",
          "name": "Hardened Reinforcement",
          "priority": "P1",
          "note": "Nível 8 na fonte.",
          "quantity": 1,
          "targetLevel": 8
        },
        {
          "id": "mod-exquisite-strike",
          "name": "Exquisite Strike",
          "priority": "P1",
          "note": "Nível 8 na fonte.",
          "quantity": 1,
          "targetLevel": 8
        }
      ]
    },
    {
      "type": "weaponTargetRolls",
      "label": "Rolls-alvo da arma",
      "sourceStatus": "confirmed",
      "sourceNote": "Atributos publicados pela fonte, na ordem exibida.",
      "items": [
        {
          "id": "roll-melee-weapon-atk",
          "name": "Melee Weapon ATK",
          "priority": null,
          "note": "Roll confirmado na fonte.",
          "quantity": 1
        },
        {
          "id": "roll-melee-weapon-toxic-atk",
          "name": "Melee Weapon Toxic ATK",
          "priority": null,
          "note": "Roll confirmado na fonte.",
          "quantity": 1
        },
        {
          "id": "roll-additional-attack-chance",
          "name": "Additional Attack Chance",
          "priority": null,
          "note": "Roll confirmado na fonte.",
          "quantity": 1
        },
        {
          "id": "roll-additional-attack-damage",
          "name": "Additional Attack Damage",
          "priority": null,
          "note": "Roll confirmado na fonte.",
          "quantity": 1
        }
      ]
    },
    {
      "type": "weaponCores",
      "label": "Configuração de cores da arma",
      "sourceStatus": "confirmed",
      "sourceNote": "Augmentations publicadas pela fonte, na ordem exibida.",
      "items": [
        {
          "id": "core-melee-weapon-atk",
          "name": "Melee Weapon ATK",
          "priority": null,
          "note": "Augmentation confirmada na fonte.",
          "quantity": 1
        },
        {
          "id": "core-melee-weapon-toxic-atk",
          "name": "Melee Weapon Toxic ATK",
          "priority": null,
          "note": "Augmentation confirmada na fonte.",
          "quantity": 1
        },
        {
          "id": "core-additional-attack-chance",
          "name": "Additional Attack Chance",
          "priority": null,
          "note": "Augmentation confirmada na fonte.",
          "quantity": 1
        },
        {
          "id": "core-additional-attack-damage",
          "name": "Additional Attack Damage",
          "priority": null,
          "note": "Augmentation confirmada na fonte.",
          "quantity": 1
        },
        {
          "id": "core-additional-attack-damage",
          "name": "Additional Attack Damage",
          "priority": null,
          "note": "Augmentation confirmada na fonte.",
          "quantity": 1
        }
      ]
    }
  ]
}
