{
  "id": "blair-ultimate-mobbing",
  "descendant": "Ultimate Blair",
  "title": "Ultimate Blair — Fire Mobbing",
  "patch": "S3E4",
  "updatedAt": "2026-03-20",
  "source": {
    "author": "kadnar",
    "url": "https://tfd.gameslantern.com/builds/019c8368-a287-73b0-8426-645ecf0addfb/blair-mobbing",
    "type": "article"
  },
  "sections": [
    {
      "type": "descendantModules",
      "label": "Módulos do Descendant",
      "items": [
        {
          "id": "mod-next-level-recipe",
          "name": "Next-level Recipe",
          "priority": "P0",
          "note": "Transcendent da build.",
          "quantity": 1
        },
        {
          "id": "mod-front-lines",
          "name": "Front Lines",
          "priority": "P1",
          "note": "Dano crítico.",
          "quantity": 1
        },
        {
          "id": "mod-emergency-measures",
          "name": "Emergency Measures",
          "priority": "P1",
          "note": "Crítico.",
          "quantity": 1
        },
        {
          "id": "mod-skill-concentration",
          "name": "Skill Concentration",
          "priority": "P1",
          "note": "Dano crítico.",
          "quantity": 1
        },
        {
          "id": "mod-focus-on-dimension",
          "name": "Focus on Dimension",
          "priority": "P1",
          "note": "Dimension Skill Power.",
          "quantity": 1
        },
        {
          "id": "mod-mid-air-maneuvering",
          "name": "Mid-Air Maneuvering",
          "priority": "P2",
          "note": "Mobilidade.",
          "quantity": 1
        },
        {
          "id": "mod-nimble-fingers",
          "name": "Nimble Fingers",
          "priority": "P1",
          "note": "Cooldown.",
          "quantity": 1
        },
        {
          "id": "mod-mp-conversion",
          "name": "MP Conversion",
          "priority": "P1",
          "note": "Sustain.",
          "quantity": 1
        },
        {
          "id": "mod-skill-expansion",
          "name": "Skill Expansion",
          "priority": "P1",
          "note": "Área.",
          "quantity": 1
        },
        {
          "id": "mod-skill-extension",
          "name": "Skill Extension",
          "priority": "P1",
          "note": "Duração.",
          "quantity": 1
        },
        {
          "id": "mod-focus-on-fire",
          "name": "Focus on Fire",
          "priority": "P1",
          "note": "Fire Skill Power.",
          "quantity": 1
        }
      ]
    },
    {
      "type": "reactor",
      "label": "Reator",
      "items": [
        {
          "id": "reactor-burning-singularity",
          "name": "Burning Singularity Reactor",
          "priority": "P0",
          "note": "Fire + Dimension.",
          "quantity": 1
        },
        {
          "id": "roll-skill-cooldown",
          "name": "Skill Cooldown",
          "priority": "P1",
          "note": "Roll alvo.",
          "quantity": 1
        },
        {
          "id": "roll-skill-critical-hit-damage",
          "name": "Skill Critical Hit Damage",
          "priority": "P1",
          "note": "Roll alvo.",
          "quantity": 1
        }
      ]
    },
    {
      "type": "weapon",
      "label": "Arma principal",
      "items": [
        {
          "id": "weapon-truly-deadly-arson",
          "name": "Truly Deadly Arson",
          "priority": "P0",
          "note": "Arma principal confirmada na fonte.",
          "quantity": 1
        }
      ]
    },
    {
      "type": "weaponModules",
      "label": "Módulos da arma",
      "sourceStatus": "confirmed",
      "sourceNote": "Configuração publicada pela fonte da build.",
      "items": [
        {
          "id": "mod-brisk-walk",
          "name": "Brisk Walk",
          "priority": "P1",
          "note": "Nível 21 na fonte.",
          "quantity": 1,
          "targetLevel": 21
        }
      ]
    },
    {
      "type": "weaponTargetRolls",
      "label": "Rolls-alvo da arma",
      "sourceStatus": "confirmed",
      "sourceNote": "Atributos publicados pela fonte, na ordem exibida.",
      "items": [
        {
          "id": "roll-firearm-critical-hit-rate",
          "name": "Firearm Critical Hit Rate",
          "priority": null,
          "note": "Roll confirmado na fonte.",
          "quantity": 1
        },
        {
          "id": "roll-firearm-critical-hit-damage",
          "name": "Firearm Critical Hit Damage",
          "priority": null,
          "note": "Roll confirmado na fonte.",
          "quantity": 1
        },
        {
          "id": "roll-fire-atk",
          "name": "Fire ATK",
          "priority": null,
          "note": "Roll confirmado na fonte.",
          "quantity": 1
        },
        {
          "id": "roll-firearm-atk",
          "name": "Firearm ATK",
          "priority": null,
          "note": "Roll confirmado na fonte.",
          "quantity": 1
        }
      ]
    },
    {
      "type": "weaponCores",
      "label": "Configuração de cores da arma",
      "sourceStatus": "confirmed",
      "sourceNote": "Augmentations publicadas pela fonte, na ordem exibida.",
      "items": [
        {
          "id": "core-sprint-speed",
          "name": "Sprint Speed",
          "priority": null,
          "note": "Augmentation confirmada na fonte.",
          "quantity": 1
        },
        {
          "id": "core-fire-atk",
          "name": "Fire ATK",
          "priority": null,
          "note": "Augmentation confirmada na fonte.",
          "quantity": 1
        },
        {
          "id": "core-fire-atk",
          "name": "Fire ATK",
          "priority": null,
          "note": "Augmentation confirmada na fonte.",
          "quantity": 1
        },
        {
          "id": "core-rounds-per-magazine",
          "name": "Rounds per Magazine",
          "priority": null,
          "note": "Augmentation confirmada na fonte.",
          "quantity": 1
        },
        {
          "id": "core-additional-weapon-atk-vs-legion-of-darkness",
          "name": "Additional Weapon ATK (vs. Legion of Darkness)",
          "priority": null,
          "note": "Augmentation confirmada na fonte.",
          "quantity": 1
        }
      ]
    }
  ]
}
