{
  "id": "lepic-ultimate-mobbing",
  "descendant": "Ultimate Lepic",
  "title": "Ultimate Lepic — Explosive Mobbing",
  "patch": "S3E4",
  "updatedAt": "2026-04-20",
  "source": {
    "author": "Voodoo / xAlisa",
    "url": "https://tfd.gameslantern.com/builds/019cfb0b-79d9-712a-9dfd-e80a2d292888/ult-lepic-mobbing",
    "type": "article"
  },
  "sections": [
    {
      "type": "descendantModules",
      "label": "Módulos do Descendant",
      "items": [
        {
          "id": "mod-explosive-stacks",
          "name": "Explosive Stacks",
          "priority": "P0",
          "note": "Base da configuração explosiva.",
          "quantity": 1
        },
        {
          "id": "mod-nimble-fingers",
          "name": "Nimble Fingers",
          "priority": "P1",
          "note": "Cooldown.",
          "quantity": 1
        },
        {
          "id": "mod-focus-on-tech",
          "name": "Focus on Tech",
          "priority": "P1",
          "note": "Tech Skill Power.",
          "quantity": 1
        },
        {
          "id": "mod-focus-on-fire",
          "name": "Focus on Fire",
          "priority": "P1",
          "note": "Fire Skill Power.",
          "quantity": 1
        },
        {
          "id": "mod-mp-conversion",
          "name": "MP Conversion",
          "priority": "P1",
          "note": "Sustain.",
          "quantity": 1
        },
        {
          "id": "mod-amplification-control",
          "name": "Amplification Control",
          "priority": "P1",
          "note": "Alcance.",
          "quantity": 1
        },
        {
          "id": "mod-mid-air-maneuvering",
          "name": "Mid-Air Maneuvering",
          "priority": "P2",
          "note": "Mobilidade.",
          "quantity": 1
        },
        {
          "id": "mod-emergency-measures",
          "name": "Emergency Measures",
          "priority": "P1",
          "note": "Crítico.",
          "quantity": 1
        },
        {
          "id": "mod-skill-expansion",
          "name": "Skill Expansion",
          "priority": "P1",
          "note": "Área.",
          "quantity": 1
        },
        {
          "id": "mod-skill-insight",
          "name": "Skill Insight",
          "priority": "P1",
          "note": "Taxa crítica.",
          "quantity": 1
        },
        {
          "id": "mod-skill-concentration",
          "name": "Skill Concentration",
          "priority": "P1",
          "note": "Dano crítico.",
          "quantity": 1
        }
      ]
    },
    {
      "type": "weapon",
      "label": "Arma principal",
      "items": [
        {
          "id": "weapon-python",
          "name": "Python",
          "priority": "P0",
          "note": "Arma indicada pela fonte.",
          "quantity": 1
        }
      ]
    },
    {
      "type": "reactor",
      "label": "Reator",
      "items": [
        {
          "id": "reactor-burning-singularity",
          "name": "Burning Singularity Reactor",
          "priority": "P0",
          "note": "Fire + Tech.",
          "quantity": 1
        },
        {
          "id": "roll-skill-cooldown",
          "name": "Skill Cooldown",
          "priority": "P1",
          "note": "Roll alvo.",
          "quantity": 1
        }
      ]
    },
    {
      "type": "weaponModules",
      "label": "Módulos da arma",
      "sourceStatus": "confirmed",
      "sourceNote": "Configuração publicada pela fonte da build.",
      "items": [
        {
          "id": "mod-sharp-precision-shot",
          "name": "Sharp Precision Shot",
          "priority": "P1",
          "note": "Nível 8 na fonte.",
          "quantity": 1,
          "targetLevel": 8
        },
        {
          "id": "mod-rifling-reinforcement",
          "name": "Rifling Reinforcement",
          "priority": "P1",
          "note": "Nível 21 na fonte.",
          "quantity": 1,
          "targetLevel": 21
        },
        {
          "id": "mod-expand-general-magazine",
          "name": "Expand General Magazine",
          "priority": "P1",
          "note": "Nível 7 na fonte.",
          "quantity": 1,
          "targetLevel": 7
        },
        {
          "id": "mod-fire-rate-up",
          "name": "Fire Rate UP",
          "priority": "P1",
          "note": "Nível 6 na fonte.",
          "quantity": 1,
          "targetLevel": 6
        },
        {
          "id": "mod-recycling-genius",
          "name": "Recycling Genius",
          "priority": "P1",
          "note": "Nível 7 na fonte.",
          "quantity": 1,
          "targetLevel": 7
        },
        {
          "id": "mod-compulsive-magazine",
          "name": "Compulsive Magazine",
          "priority": "P1",
          "note": "Nível 8 na fonte.",
          "quantity": 1,
          "targetLevel": 8
        },
        {
          "id": "mod-expand-weapon-charge",
          "name": "Expand Weapon Charge",
          "priority": "P1",
          "note": "Nível 8 na fonte.",
          "quantity": 1,
          "targetLevel": 8
        },
        {
          "id": "mod-better-weapon-weight",
          "name": "Better Weapon Weight",
          "priority": "P1",
          "note": "Nível 6 na fonte.",
          "quantity": 1,
          "targetLevel": 6
        }
      ]
    },
    {
      "type": "weaponTargetRolls",
      "label": "Rolls-alvo da arma",
      "sourceStatus": "confirmed",
      "sourceNote": "Atributos publicados pela fonte, na ordem exibida.",
      "items": [
        {
          "id": "roll-firearm-atk",
          "name": "Firearm ATK",
          "priority": null,
          "note": "Roll confirmado na fonte.",
          "quantity": 1
        },
        {
          "id": "roll-multi-hit-damage",
          "name": "Multi-Hit Damage",
          "priority": null,
          "note": "Roll confirmado na fonte.",
          "quantity": 1
        },
        {
          "id": "roll-multi-hit-chance",
          "name": "Multi-Hit Chance",
          "priority": null,
          "note": "Roll confirmado na fonte.",
          "quantity": 1
        },
        {
          "id": "roll-weak-point-damage",
          "name": "Weak Point Damage",
          "priority": null,
          "note": "Roll confirmado na fonte.",
          "quantity": 1
        }
      ]
    },
    {
      "type": "weaponCores",
      "label": "Configuração de cores da arma",
      "sourceStatus": "confirmed",
      "sourceNote": "Augmentations publicadas pela fonte, na ordem exibida.",
      "items": [
        {
          "id": "core-rounds-per-magazine",
          "name": "Rounds per Magazine",
          "priority": null,
          "note": "Augmentation confirmada na fonte.",
          "quantity": 1
        },
        {
          "id": "core-firearm-atk",
          "name": "Firearm ATK",
          "priority": null,
          "note": "Augmentation confirmada na fonte.",
          "quantity": 1
        },
        {
          "id": "core-fire-rate",
          "name": "Fire Rate",
          "priority": null,
          "note": "Augmentation confirmada na fonte.",
          "quantity": 1
        },
        {
          "id": "core-grappling-hook-charge-time-increase-ratio",
          "name": "Grappling Hook Charge Time Increase Ratio",
          "priority": null,
          "note": "Augmentation confirmada na fonte.",
          "quantity": 1
        },
        {
          "id": "core-sprint-speed",
          "name": "Sprint Speed",
          "priority": null,
          "note": "Augmentation confirmada na fonte.",
          "quantity": 1
        }
      ]
    }
  ]
}
